10:56:37.949639 IP 192.168.0.254.mdns > 224.0.0.251.mdns: 0 SRV (QM)? Freebox Player._airplay._tcp.local. (52)
10:56:37.957867 IP 192.168.0.12.mdns > 224.0.0.251.mdns: 0*- [0q] 2/0/0 (Cache flush) SRV Freebox-Player.local.:7000 0 0, (Cache flush) A 192.168.0.12 (97)
10:56:38.458164 IP 192.168.0.36.32919 > 192.168.0.254.domain: 8159+ PTR? 251.0.0.224.in-addr.arpa. (42)
10:56:38.494349 IP 192.168.0.254.domain > 192.168.0.36.32919: 8159 NXDomain 0/1/0 (99)
10:56:38.494514 IP 192.168.0.36.40278 > 192.168.0.254.domain: 41787+ PTR? 254.0.168.192.in-addr.arpa. (44)
10:56:38.494812 IP 192.168.0.254.domain > 192.168.0.36.40278: 41787 NXDomain* 0/0/0 (44)
10:56:38.494985 IP 192.168.0.36.33567 > 192.168.0.254.domain: 16813+ PTR? 12.0.168.192.in-addr.arpa. (43)
10:56:38.495257 IP 192.168.0.254.domain > 192.168.0.36.33567: 16813 NXDomain* 0/0/0 (43)
10:56:39.457755 IP 192.168.0.36.28401 > 192.168.0.254.domain: 5706+ PTR? 36.0.168.192.in-addr.arpa. (43)
10:56:39.458285 IP 192.168.0.254.domain > 192.168.0.36.28401: 5706 NXDomain* 0/0/0 (43)
10:56:43.180713 IP6 fe80::160c:76ff:fe40:95ae.mdns > ff02::fb.mdns: 0 SRV (QM)? 140C764095AE@Freebox Player._raop._tcp.local. (62)
10:56:43.180737 IP6 fe80::160c:76ff:fe40:95ae.mdns > ff02::fb.mdns: 0*- [0q] 2/0/0 (Cache flush) SRV Freebox-Player.local.:5000 0 0, (Cache flush) AAAA fe80::160c:76ff:fe40:95ae (119)
10:56:43.457808 IP 192.168.0.36.37346 > 192.168.0.254.domain: 2710+ PTR? b.f.0.0.0.0.0.0.0.0.0.0.0.0.0.0.0.0.0.0.0.0.0.0.0.0.0.0.2.0.f.f.ip6.arpa. (90)
10:56:43.465540 ARP, Request who-has 192.168.0.254 tell 192.168.0.36, length 28
10:56:43.465652 ARP, Reply 192.168.0.254 is-at f4:ca:e5:4a:24:f7 (oui Unknown), length 46
10:56:43.575062 IP 192.168.0.254.domain > 192.168.0.36.37346: 2710 NXDomain 0/1/0 (160)
10:56:43.575236 IP 192.168.0.36.53072 > 192.168.0.254.domain: 21042+ PTR? e.a.5.9.0.4.e.f.f.f.6.7.c.0.6.1.0.0.0.0.0.0.0.0.0.0.0.0.0.8.e.f.ip6.arpa. (90)
10:56:43.610287 IP 192.168.0.254.domain > 192.168.0.36.53072: 21042 NXDomain* 0/1/0 (149)

